{
  "id": "HUV_003",
  "name": "Service Capabilities",
  "suite": "identity",
  "type": "single",
  "priority": 4,
  "tags": ["identity", "capabilities", "services", "chinese"],
  "config": {
    "timeout": 30,
    "retries": 0,
    "parallel_safe": true,
    "requirements": ["humansa_v2", "pattern2"]
  },
  "setup": {
    "user_context": {
      "user_id": "test_user_003",
      "profile": {}
    },
    "previous_turns": [],
    "environment": {
      "HUMANSA_USE_PATTERN2": "true"
    }
  },
  "execution": {
    "endpoint": "/v2/humansa/responses/create",
    "method": "POST",
    "headers": {
      "Content-Type": "application/json"
    },
    "payload": {
      "model": "gpt-4.1",
      "input": "你能做什么？",
      "user_id": "test_user_003",
      "metadata": {
        "test_id": "HUV_003",
        "test_name": "Service Capabilities",
        "orchestrator": "pattern2"
      }
    }
  },
  "expectations": {
    "response": {
      "status_code": 200,
      "output_contains": ["健康咨询", "实时预约", "检查项目", "诊所导航", "体检报告"],
      "min_length": 100
    },
    "reasoning": {
      "steps_min": 1,
      "contains_keywords": ["capabilities", "services", "features"]
    },
    "agents": {
      "touched": ["FunctionAgent"],
      "max_agents": 3
    },
    "context": {
      "mem0": {
        "should_store": ["capabilities inquiry", "service request"],
        "memory_count": 1
      }
    },
    "server_logs": {
      "contains": ["Pattern 2", "capabilities"],
      "excludes": ["ERROR", "exception"],
      "log_levels": {
        "ERROR": "=0"
      }
    },
    "performance": {
      "response_time_max": 30,
      "token_usage_max": 1000
    }
  },
  "cleanup": {
    "commands": [],
    "reset_context": false
  }
}