{
  "id": "IDT_001",
  "name": "Basic Identity Query",
  "suite": "identity",
  "type": "single",
  "priority": 5,
  "tags": ["identity", "basic", "introduction", "chinese"],
  "config": {
    "timeout": 30,
    "retries": 0,
    "parallel_safe": true,
    "requirements": ["humansa_v2", "identity_knowledge"]
  },
  "setup": {
    "user_context": {
      "user_id": "test_user_idt_001",
      "profile": {}
    },
    "previous_turns": [],
    "environment": {}
  },
  "execution": {
    "endpoint": "/v2/humansa/responses/create",
    "method": "POST",
    "headers": {
      "Content-Type": "application/json"
    },
    "payload": {
      "model": "gpt-4.1",
      "input": "你是谁？",
      "user_id": "test_user_idt_001"
    }
  },
  "expectations": {
    "response": {
      "status_code": 200,
      "output_contains": ["诺亚新舟", "小诺", "健康医疗助理", "AI健康管家"],
      "min_length": 50
    },
    "reasoning": {
      "steps_min": 1,
      "contains_keywords": ["identity", "introduction", "medical_assistant"],
      "tool_calls": ["identity_response"]
    },
    "agents": {
      "touched": ["IdentityAgent"],
      "max_agents": 2
    },
    "context": {
      "mem0": {
        "should_store": ["identity query", "user interaction"],
        "memory_count": 1
      }
    },
    "server_logs": {
      "contains": ["identity query", "medical assistant"],
      "excludes": ["ERROR", "exception"],
      "log_levels": {
        "ERROR": "=0"
      }
    },
    "performance": {
      "response_time_max": 15,
      "token_usage_max": 500
    }
  },
  "cleanup": {
    "commands": [],
    "reset_context": false
  }
}